{
  "kind": "eidos.capability-registry",
  "version": 1,
  "generated_at": "2026-06-14T22:00:00Z",
  "public_catalog_url": "https://eidosagi.com/.well-known/eidos/plugin-store.json",
  "schema_url": "https://eidosagi.com/.well-known/eidos/capability-registry.schema.json",
  "plugins": [
    {
      "slug": "eidos-plugin-store",
      "name": "Eidos AGI Catalog",
      "summary": "Capability registry and bootstrap catalog for Eidos plugins.",
      "owns": {
        "domain": "Eidos plugin discovery and public-safe capability metadata.",
        "boundary": "Maintains machine-readable catalog contracts and install guidance.",
        "does_not_own": [
          "specialist runtime execution",
          "secret material",
          "private machine inventory"
        ]
      },
      "commands": [
        {
          "name": "read_catalog",
          "command": "curl -fsSL https://eidosagi.com/.well-known/eidos/plugin-store.json",
          "purpose": "Read the public plugin catalog."
        },
        {
          "name": "validate_capabilities",
          "command": "python3 scripts/validate_capability_registry.py examples/capability-registry.sample.json",
          "purpose": "Validate routing metadata before publication."
        }
      ],
      "proof_types": [
        "catalog JSON",
        "schema validation output",
        "install guidance"
      ],
      "hard_stops": [
        "do not publish private local paths",
        "do not publish secrets",
        "do not claim installed status without host proof"
      ],
      "dependencies": [
        "Codex",
        "Python 3"
      ],
      "works_with": [
        "eidos",
        "felix",
        "forge-forge"
      ],
      "eidos_routes": [
        {
          "when": "A task asks which Eidos plugin should own a capability.",
          "stack": [
            "eidos-plugin-store",
            "eidos"
          ],
          "proof_required": [
            "catalog entry",
            "capability validation"
          ]
        }
      ],
      "install_status": {
        "source": {
          "repo": "eidos-agi/eidos-plugin-store",
          "url": "https://github.com/eidos-agi/eidos-plugin-store"
        },
        "installed": {
          "status": "installed",
          "host": "codex",
          "version": "0.1.0",
          "path_kind": "codex-cache"
        },
        "public_catalog": {
          "status": "listed",
          "url": "https://eidosagi.com/.well-known/eidos/plugin-store.json"
        },
        "live_version": "0.1.0",
        "last_verified": "2026-06-14T22:00:00Z"
      },
      "quality": {
        "test_command": "python3 scripts/validate_capability_registry.py examples/capability-registry.sample.json",
        "smoke_command": "curl -fsSL https://eidosagi.com/.well-known/eidos/plugin-store.json",
        "docs": [
          "README.md",
          "docs/capability-contract.md"
        ],
        "last_proof": {
          "status": "current",
          "date": "2026-06-14",
          "summary": "Schema and sample registry validate locally."
        }
      }
    },
    {
      "slug": "eidos",
      "name": "Eidos",
      "summary": "Coordinator for tracked task loops, evidence, routing, closeout, and learning.",
      "owns": {
        "domain": "Eidos task orchestration and evidence lifecycle.",
        "boundary": "Coordinates specialist routing and verifies proof without absorbing specialist runtimes.",
        "does_not_own": [
          "browser automation runtime",
          "worktree worker execution",
          "ceremony enforcement runtime",
          "secret value storage"
        ]
      },
      "commands": [
        {
          "name": "orient",
          "command": "eidos status",
          "purpose": "Read current Eidos scope."
        },
        {
          "name": "execute_task",
          "command": "eidos do <task-id>",
          "purpose": "Create a tracked task context and continuation envelope."
        },
        {
          "name": "closeout",
          "command": "eidos closeout",
          "purpose": "Verify cleanup and proof gates before completion claims."
        }
      ],
      "proof_types": [
        "context bundle",
        "continuation envelope",
        "praxis turn",
        "closeout report"
      ],
      "hard_stops": [
        "MFA",
        "payments",
        "legal agreements",
        "secret disclosure",
        "irreversible deploy or account mutation"
      ],
      "dependencies": [
        "Codex",
        "Python 3",
        "git"
      ],
      "works_with": [
        "eidos-plugin-store",
        "foreman",
        "stepproof",
        "converge",
        "surfari",
        "knox",
        "felix",
        "rhea",
        "forge-forge"
      ],
      "eidos_routes": [
        {
          "when": "A task needs governed execution with evidence and closeout.",
          "stack": [
            "eidos"
          ],
          "proof_required": [
            "eidos do output",
            "evidence path",
            "closeout output"
          ]
        }
      ],
      "install_status": {
        "source": {
          "repo": "eidos-agi/eidos-cli",
          "url": "https://github.com/eidos-agi/eidos-cli"
        },
        "installed": {
          "status": "installed",
          "host": "codex",
          "version": "0.1.0",
          "path_kind": "codex-cache"
        },
        "public_catalog": {
          "status": "listed",
          "url": "https://eidosagi.com/.well-known/eidos/plugin-store.json"
        },
        "live_version": "0.1.0",
        "last_verified": "2026-06-14T22:00:00Z"
      },
      "quality": {
        "test_command": "python3 -m pytest -q",
        "smoke_command": "eidos status",
        "docs": [
          "skills/use-eidos-cli/SKILL.md",
          "eidos_cli/guides/plugins.md"
        ],
        "last_proof": {
          "status": "current",
          "date": "2026-06-14",
          "summary": "Local CLI responded; current workspace root is not itself an Eidos scope."
        }
      }
    },
    {
      "slug": "foreman",
      "name": "Foreman",
      "summary": "Delegates scoped coding work to AI workers in isolated git worktrees.",
      "owns": {
        "domain": "Multi-agent coding delegation and worker lifecycle.",
        "boundary": "Creates worktrees, runs worker engines, exposes status, collect, and finalization evidence.",
        "does_not_own": [
          "architectural acceptance decisions",
          "secret handling",
          "deploy approvals"
        ]
      },
      "commands": [
        {
          "name": "route",
          "command": "foreman route <task>",
          "purpose": "Rank worker engines and control needs."
        },
        {
          "name": "delegate",
          "command": "foreman delegate <task>",
          "purpose": "Dispatch a narrow task to an isolated worker."
        },
        {
          "name": "claude_emux",
          "command": "foreman delegate --engine claude-emux <task>",
          "purpose": "Launch an interactive Claude Code worker through Emux."
        },
        {
          "name": "collect",
          "command": "foreman collect <run-id>",
          "purpose": "Collect worker diff, logs, and verification evidence for parent review."
        }
      ],
      "proof_types": [
        "worker id",
        "run id",
        "Foreman-ready worker packet",
        "worktree path kind",
        "diff summary",
        "test output",
        "emux head command",
        "emux capture command",
        "emux interrupt command",
        "emux watch command"
      ],
      "hard_stops": [
        "broad architecture delegation",
        "secret use",
        "destructive git actions",
        "deploys",
        "payments"
      ],
      "dependencies": [
        "git",
        "tmux",
        "emux",
        "claude for claude-emux",
        "worker engine CLI"
      ],
      "works_with": [
        "eidos",
        "emux",
        "converge",
        "stepproof"
      ],
      "eidos_routes": [
        {
          "when": "A coding task splits into independent file-scoped implementation slices.",
          "stack": [
            "eidos",
            "foreman"
          ],
          "proof_required": [
            "worker run id",
            "collected diff",
            "parent verification command"
          ]
        },
        {
          "when": "A Pod packet needs a watchable, capturable, and interruptible Claude Code worker.",
          "stack": [
            "eidos",
            "foreman",
            "emux"
          ],
          "proof_required": [
            "Foreman-ready packet",
            "foreman run id",
            "worker worktree path",
            "emux head command",
            "emux capture command",
            "emux interrupt command",
            "parent verification command"
          ],
          "notes": "Use `claude-emux` only when operator watch/interrupt matters. Foreman owns worker lifecycle; Emux owns terminal control. Required host binaries are emux, tmux, and claude."
        }
      ],
      "install_status": {
        "source": {
          "repo": "eidos-agi/foreman",
          "url": "https://github.com/eidos-agi/foreman"
        },
        "installed": {
          "status": "installed",
          "host": "codex",
          "version": "0.3.1",
          "path_kind": "codex-cache"
        },
        "public_catalog": {
          "status": "listed",
          "url": "https://eidosagi.com/.well-known/eidos/plugin-store.json"
        },
        "live_version": "0.3.1",
        "last_verified": "2026-06-14T22:00:00Z"
      },
      "quality": {
        "test_command": "python3 scripts/release_gate.py",
        "smoke_command": "python3 scripts/smoke_test.py",
        "docs": [
          "README.md",
          "skills/delegate-with-foreman/SKILL.md"
        ],
        "last_proof": {
          "status": "unknown",